{
  "$schema": "https://json-schema.org/draft/2020-12/schema",
  "title": "HostStateReportV2",
  "type": "object",
  "properties": {
    "applied_desired_version": {
      "type": "integer",
      "format": "uint64",
      "minimum": 0
    },
    "builds": {
      "type": "array",
      "items": {
        "$ref": "#/$defs/BuildReportV1"
      }
    },
    "cached_images": {
      "type": "array",
      "items": {
        "$ref": "#/$defs/CachedImageStateV1"
      }
    },
    "capabilities": {
      "$ref": "#/$defs/HostCapabilitiesV2"
    },
    "capacity": {
      "$ref": "#/$defs/HostCapacityV2"
    },
    "host_id": {
      "type": "string"
    },
    "observed_at_unix_ms": {
      "type": "integer",
      "format": "int64"
    },
    "schema_version": {
      "type": "integer",
      "format": "uint16",
      "maximum": 4,
      "minimum": 4
    },
    "vms": {
      "type": "array",
      "items": {
        "$ref": "#/$defs/VmActualStateV2"
      }
    }
  },
  "required": [
    "schema_version",
    "host_id",
    "observed_at_unix_ms",
    "applied_desired_version",
    "capacity",
    "capabilities",
    "cached_images",
    "vms",
    "builds"
  ],
  "$defs": {
    "BuildPhase": {
      "type": "string",
      "enum": [
        "queued",
        "fetching_sources",
        "building_base",
        "building",
        "publishing",
        "uploading_logs",
        "succeeded",
        "failed"
      ]
    },
    "BuildReportV1": {
      "type": "object",
      "properties": {
        "attempt": {
          "type": "integer",
          "format": "uint32",
          "minimum": 0
        },
        "build_id": {
          "type": "string"
        },
        "content_hash": {
          "type": "string"
        },
        "current_vm": {
          "type": [
            "string",
            "null"
          ]
        },
        "error": {
          "type": [
            "string",
            "null"
          ]
        },
        "finished_at_unix_ms": {
          "type": [
            "integer",
            "null"
          ],
          "format": "int64"
        },
        "host_id": {
          "type": "string"
        },
        "observed_at_unix_ms": {
          "type": "integer",
          "format": "int64"
        },
        "phase": {
          "$ref": "#/$defs/BuildPhase"
        },
        "scenario_id": {
          "type": "string"
        },
        "schema_version": {
          "type": "integer",
          "format": "uint16",
          "maximum": 65535,
          "minimum": 0
        },
        "started_at_unix_ms": {
          "type": [
            "integer",
            "null"
          ],
          "format": "int64"
        }
      },
      "required": [
        "schema_version",
        "host_id",
        "build_id",
        "scenario_id",
        "content_hash",
        "observed_at_unix_ms",
        "phase",
        "attempt"
      ]
    },
    "CachedImageStateV1": {
      "type": "object",
      "properties": {
        "bytes_on_disk": {
          "type": [
            "integer",
            "null"
          ],
          "format": "uint64",
          "minimum": 0
        },
        "error": {
          "type": [
            "string",
            "null"
          ]
        },
        "image_key": {
          "$ref": "#/$defs/ImageKey"
        },
        "image_sha256": {
          "type": "string"
        },
        "phase": {
          "$ref": "#/$defs/ImageCachePhase"
        },
        "updated_at_unix_ms": {
          "type": "integer",
          "format": "int64"
        }
      },
      "required": [
        "image_key",
        "image_sha256",
        "phase",
        "updated_at_unix_ms"
      ]
    },
    "HostCapabilitiesV2": {
      "type": "object",
      "properties": {
        "arch": {
          "$ref": "#/$defs/ImageArchitecture"
        },
        "boot_cpu_lease_ms": {
          "type": [
            "integer",
            "null"
          ],
          "format": "uint64",
          "minimum": 0
        },
        "boot_cpu_millis": {
          "type": [
            "integer",
            "null"
          ],
          "format": "uint32",
          "minimum": 0
        },
        "cloud_hypervisor_sha256": {
          "description": "Root-owned runtime identity and lease policy. `None` means the host has\nno live jailerd attestation and is never performance-ready.",
          "type": [
            "string",
            "null"
          ]
        },
        "fast_template_store": {
          "type": "boolean"
        },
        "supports_boot_cpu_lease": {
          "type": "boolean"
        },
        "supports_cgroup_v2": {
          "type": "boolean"
        },
        "supports_hard_cpu_quota": {
          "type": "boolean"
        },
        "supports_jailer_v2": {
          "type": "boolean"
        },
        "supports_kvm": {
          "type": "boolean"
        },
        "supports_landlock": {
          "type": "boolean"
        },
        "supports_nftables": {
          "type": "boolean"
        },
        "supports_reflink": {
          "type": "boolean"
        },
        "supports_template_backed_launch": {
          "type": "boolean"
        },
        "supports_vsock": {
          "type": "boolean"
        }
      },
      "required": [
        "arch",
        "supports_kvm",
        "supports_vsock",
        "supports_reflink",
        "supports_nftables",
        "supports_jailer_v2",
        "supports_boot_cpu_lease",
        "supports_template_backed_launch",
        "fast_template_store",
        "supports_hard_cpu_quota",
        "supports_landlock",
        "supports_cgroup_v2"
      ]
    },
    "HostCapacityV2": {
      "type": "object",
      "properties": {
        "committed_cpu_millis": {
          "type": "integer",
          "format": "uint32",
          "minimum": 0
        },
        "disk_available_mib": {
          "type": "integer",
          "format": "uint32",
          "minimum": 0
        },
        "disk_probe_path": {
          "description": "Filesystem the disk figures were probed on (the VM/image data root).",
          "type": "string"
        },
        "disk_total_mib": {
          "type": "integer",
          "format": "uint32",
          "minimum": 0
        },
        "load_avg_15m": {
          "type": [
            "number",
            "null"
          ],
          "format": "double"
        },
        "load_avg_1m": {
          "type": [
            "number",
            "null"
          ],
          "format": "double"
        },
        "load_avg_5m": {
          "type": [
            "number",
            "null"
          ],
          "format": "double"
        },
        "memory_available_mib": {
          "type": "integer",
          "format": "uint32",
          "minimum": 0
        },
        "memory_total_mib": {
          "type": "integer",
          "format": "uint32",
          "minimum": 0
        },
        "primary_ipv4": {
          "type": [
            "string",
            "null"
          ]
        },
        "primary_ipv6": {
          "type": [
            "string",
            "null"
          ]
        },
        "reserved_cpu_millis": {
          "type": "integer",
          "format": "uint32",
          "minimum": 0
        },
        "schedulable_cpu_millis": {
          "type": "integer",
          "format": "uint32",
          "minimum": 0
        },
        "total_cpu_millis": {
          "type": "integer",
          "format": "uint32",
          "minimum": 0
        }
      },
      "required": [
        "total_cpu_millis",
        "reserved_cpu_millis",
        "schedulable_cpu_millis",
        "committed_cpu_millis",
        "memory_total_mib",
        "memory_available_mib",
        "disk_probe_path",
        "disk_total_mib",
        "disk_available_mib"
      ]
    },
    "ImageArchitecture": {
      "type": "string",
      "enum": [
        "x86_64",
        "aarch64"
      ]
    },
    "ImageCachePhase": {
      "type": "string",
      "enum": [
        "missing",
        "queued",
        "downloading",
        "ready",
        "failed"
      ]
    },
    "ImageKey": {
      "type": "object",
      "properties": {
        "arch": {
          "$ref": "#/$defs/ImageArchitecture"
        },
        "scenario": {
          "type": "string"
        },
        "vm": {
          "type": "string"
        }
      },
      "required": [
        "scenario",
        "vm",
        "arch"
      ]
    },
    "ProbePhase": {
      "type": "string",
      "enum": [
        "boot",
        "scenario"
      ]
    },
    "VmActualStateV2": {
      "type": "object",
      "properties": {
        "archive": {
          "anyOf": [
            {
              "$ref": "#/$defs/VmArchiveStateV1"
            },
            {
              "type": "null"
            }
          ]
        },
        "desired_version": {
          "type": [
            "integer",
            "null"
          ],
          "format": "uint64",
          "minimum": 0
        },
        "error": {
          "type": [
            "string",
            "null"
          ]
        },
        "image_key": {
          "anyOf": [
            {
              "$ref": "#/$defs/ImageKey"
            },
            {
              "type": "null"
            }
          ]
        },
        "image_sha256": {
          "type": [
            "string",
            "null"
          ]
        },
        "network": {
          "anyOf": [
            {
              "$ref": "#/$defs/VmNetworkStateV1"
            },
            {
              "type": "null"
            }
          ]
        },
        "phase": {
          "$ref": "#/$defs/VmPhase"
        },
        "probes": {
          "type": "array",
          "items": {
            "$ref": "#/$defs/VmProbeSnapshotV1"
          }
        },
        "resource_state": {
          "anyOf": [
            {
              "$ref": "#/$defs/VmResourceStateV2"
            },
            {
              "type": "null"
            }
          ]
        },
        "run_id": {
          "type": "string"
        },
        "runtime_constraints": {
          "description": "Live CPU-boundary evidence for the VM process tree. This is distinct\nfrom the guest vCPU topology and from periodic usage accounting.",
          "anyOf": [
            {
              "$ref": "#/$defs/VmRuntimeConstraintsV1"
            },
            {
              "type": "null"
            }
          ]
        },
        "sandbox": {
          "anyOf": [
            {
              "$ref": "#/$defs/VmSandboxStateV1"
            },
            {
              "type": "null"
            }
          ]
        },
        "ssh_host_keys_openssh": {
          "type": "array",
          "items": {
            "type": "string"
          }
        },
        "terminal": {
          "description": "Explicit shell-readiness evidence. Network metadata alone is not a\nreadiness signal because the forward may be reserved before ingress is\npublished.",
          "$ref": "#/$defs/VmTerminalStateV1"
        },
        "updated_at_unix_ms": {
          "type": "integer",
          "format": "int64"
        },
        "vm_name": {
          "type": "string"
        }
      },
      "required": [
        "run_id",
        "vm_name",
        "phase",
        "terminal",
        "ssh_host_keys_openssh",
        "probes",
        "updated_at_unix_ms"
      ]
    },
    "VmArchivePhase": {
      "type": "string",
      "enum": [
        "none",
        "pending",
        "uploading",
        "complete",
        "failed"
      ]
    },
    "VmArchiveStateV1": {
      "type": "object",
      "properties": {
        "artifact_count": {
          "type": "integer",
          "format": "uint32",
          "minimum": 0
        },
        "error": {
          "type": [
            "string",
            "null"
          ]
        },
        "phase": {
          "$ref": "#/$defs/VmArchivePhase"
        }
      },
      "required": [
        "phase",
        "artifact_count"
      ]
    },
    "VmNetworkStateV1": {
      "type": "object",
      "properties": {
        "bridge_name": {
          "type": "string"
        },
        "gateway": {
          "type": "string"
        },
        "guest_cidr": {
          "type": "string"
        },
        "guest_ip": {
          "type": "string"
        },
        "ssh_host": {
          "description": "Publicly routable address of the agent host's SSH forward for this VM\n(the agent's advertised host). The guest IP is only reachable within\nthe agent's internal VM network.",
          "type": [
            "string",
            "null"
          ]
        },
        "ssh_host_port": {
          "type": [
            "integer",
            "null"
          ],
          "format": "uint16",
          "maximum": 65535,
          "minimum": 0
        }
      },
      "required": [
        "bridge_name",
        "guest_ip",
        "guest_cidr",
        "gateway"
      ]
    },
    "VmPhase": {
      "type": "string",
      "enum": [
        "pending",
        "pulling_image",
        "creating_disks",
        "booting",
        "running",
        "ready",
        "solved",
        "stopping",
        "stopped",
        "failed",
        "absent"
      ]
    },
    "VmProbeSnapshotV1": {
      "type": "object",
      "properties": {
        "checked_at_unix_ms": {
          "type": "integer",
          "format": "int64"
        },
        "id": {
          "type": "string"
        },
        "message": {
          "type": [
            "string",
            "null"
          ]
        },
        "phase": {
          "$ref": "#/$defs/ProbePhase"
        },
        "status": {
          "$ref": "#/$defs/VmProbeStatus"
        },
        "value": true
      },
      "required": [
        "id",
        "phase",
        "status",
        "checked_at_unix_ms"
      ]
    },
    "VmProbeStatus": {
      "type": "string",
      "enum": [
        "unknown",
        "pass",
        "fail"
      ]
    },
    "VmResourceStateV2": {
      "type": "object",
      "properties": {
        "cpu_millis": {
          "type": "integer",
          "format": "uint32",
          "minimum": 1
        },
        "cpu_nr_periods": {
          "type": "integer",
          "format": "uint64",
          "minimum": 0
        },
        "cpu_nr_throttled": {
          "type": "integer",
          "format": "uint64",
          "minimum": 0
        },
        "cpu_period_us": {
          "type": "integer",
          "format": "uint64",
          "minimum": 1
        },
        "cpu_quota_us": {
          "type": "integer",
          "format": "uint64",
          "minimum": 1
        },
        "cpu_system_usec": {
          "type": "integer",
          "format": "uint64",
          "minimum": 0
        },
        "cpu_throttled_usec": {
          "type": "integer",
          "format": "uint64",
          "minimum": 0
        },
        "cpu_usage_usec": {
          "type": "integer",
          "format": "uint64",
          "minimum": 0
        },
        "cpu_user_usec": {
          "type": "integer",
          "format": "uint64",
          "minimum": 0
        },
        "vcpu_count": {
          "type": "integer",
          "format": "uint16",
          "maximum": 65535,
          "minimum": 1
        }
      },
      "required": [
        "cpu_millis",
        "vcpu_count",
        "cpu_quota_us",
        "cpu_period_us",
        "cpu_usage_usec",
        "cpu_user_usec",
        "cpu_system_usec",
        "cpu_nr_periods",
        "cpu_nr_throttled",
        "cpu_throttled_usec"
      ]
    },
    "VmRuntimeConstraintPhaseV1": {
      "type": "string",
      "enum": [
        "boot_burst",
        "steady"
      ]
    },
    "VmRuntimeConstraintsV1": {
      "type": "object",
      "properties": {
        "effective_cpu_millis": {
          "type": "integer",
          "format": "uint32",
          "minimum": 1
        },
        "generation": {
          "description": "Jailer-owned generation to which every quota and ingress attestation\nin this object applies. The breaking v2 contract never accepts\ngeneration-less quota evidence.",
          "type": "string"
        },
        "lease_expires_at_unix_ms": {
          "type": [
            "integer",
            "null"
          ],
          "format": "int64"
        },
        "phase": {
          "$ref": "#/$defs/VmRuntimeConstraintPhaseV1"
        },
        "quota_verified_at_unix_ms": {
          "description": "Timestamp of the authoritative live cgroup readback. Required by the\ncontrol plane before a `steady` runtime can expose a terminal.",
          "type": [
            "integer",
            "null"
          ],
          "format": "int64"
        },
        "steady_cpu_millis": {
          "type": "integer",
          "format": "uint32",
          "minimum": 1
        }
      },
      "required": [
        "generation",
        "phase",
        "steady_cpu_millis",
        "effective_cpu_millis"
      ]
    },
    "VmSandboxStateV1": {
      "type": "object",
      "properties": {
        "cgroup_path": {
          "type": "string"
        },
        "generation": {
          "type": "string"
        },
        "healthy": {
          "type": "boolean"
        },
        "landlock_enabled": {
          "type": "boolean"
        },
        "no_new_privs": {
          "type": "boolean"
        },
        "seccomp_enabled": {
          "type": "boolean"
        },
        "systemd_unit": {
          "type": "string"
        }
      },
      "required": [
        "healthy",
        "generation",
        "systemd_unit",
        "cgroup_path",
        "seccomp_enabled",
        "landlock_enabled",
        "no_new_privs"
      ]
    },
    "VmTerminalStateKindV1": {
      "type": "string",
      "enum": [
        "pending",
        "ready",
        "failed"
      ]
    },
    "VmTerminalStateV1": {
      "type": "object",
      "properties": {
        "observed_at_unix_ms": {
          "type": "integer",
          "format": "int64"
        },
        "reason": {
          "type": [
            "string",
            "null"
          ]
        },
        "state": {
          "$ref": "#/$defs/VmTerminalStateKindV1"
        },
        "target": {
          "description": "Present only when `state` is `ready`.",
          "anyOf": [
            {
              "$ref": "#/$defs/VmTerminalTargetV1"
            },
            {
              "type": "null"
            }
          ]
        }
      },
      "required": [
        "state",
        "observed_at_unix_ms"
      ]
    },
    "VmTerminalTargetV1": {
      "type": "object",
      "properties": {
        "checked_at_unix_ms": {
          "type": "integer",
          "format": "int64"
        },
        "host": {
          "type": "string"
        },
        "port": {
          "type": "integer",
          "format": "uint16",
          "maximum": 65535,
          "minimum": 0
        },
        "username": {
          "type": "string"
        }
      },
      "required": [
        "host",
        "port",
        "username",
        "checked_at_unix_ms"
      ]
    }
  }
}
